{
  "schema_version": "gordian.repository-workload-source.v1",
  "repository": "gordian-fixture/repository-small",
  "revision": "fixture-revision-001",
  "nodes": [
    {
      "id": "task-00-00",
      "reference_duration_ticks": 2,
      "cost_units": 1,
      "required_capabilities": [
        "capability:0"
      ],
      "semantic_claims": [
        "claim:shared"
      ],
      "resource_claims": [
        "resource:shared"
      ]
    },
    {
      "id": "task-00-01",
      "reference_duration_ticks": 1,
      "cost_units": 1,
      "required_capabilities": [
        "capability:1"
      ],
      "semantic_claims": [
        "claim:shared"
      ],
      "resource_claims": [
        "resource:shared"
      ]
    },
    {
      "id": "task-00-02",
      "reference_duration_ticks": 1,
      "cost_units": 1,
      "required_capabilities": [
        "capability:0"
      ],
      "semantic_claims": [
        "claim:00:02"
      ],
      "resource_claims": [
        "resource:00:02"
      ]
    },
    {
      "id": "task-00-03",
      "reference_duration_ticks": 1,
      "cost_units": 1,
      "required_capabilities": [
        "capability:1"
      ],
      "semantic_claims": [
        "claim:00:03"
      ],
      "resource_claims": [
        "resource:00:03"
      ]
    },
    {
      "id": "task-00-04",
      "reference_duration_ticks": 1,
      "cost_units": 1,
      "required_capabilities": [
        "capability:0"
      ],
      "semantic_claims": [
        "claim:00:04"
      ],
      "resource_claims": [
        "resource:00:04"
      ]
    },
    {
      "id": "task-01-00",
      "reference_duration_ticks": 2,
      "cost_units": 1,
      "required_capabilities": [
        "capability:0"
      ],
      "semantic_claims": [
        "claim:shared"
      ],
      "resource_claims": [
        "resource:shared"
      ]
    },
    {
      "id": "task-01-01",
      "reference_duration_ticks": 1,
      "cost_units": 1,
      "required_capabilities": [
        "capability:1"
      ],
      "semantic_claims": [
        "claim:shared"
      ],
      "resource_claims": [
        "resource:shared"
      ]
    },
    {
      "id": "task-01-02",
      "reference_duration_ticks": 1,
      "cost_units": 1,
      "required_capabilities": [
        "capability:0"
      ],
      "semantic_claims": [
        "claim:01:02"
      ],
      "resource_claims": [
        "resource:01:02"
      ]
    },
    {
      "id": "task-01-03",
      "reference_duration_ticks": 1,
      "cost_units": 1,
      "required_capabilities": [
        "capability:1"
      ],
      "semantic_claims": [
        "claim:01:03"
      ],
      "resource_claims": [
        "resource:01:03"
      ]
    },
    {
      "id": "task-01-04",
      "reference_duration_ticks": 1,
      "cost_units": 1,
      "required_capabilities": [
        "capability:0"
      ],
      "semantic_claims": [
        "claim:01:04"
      ],
      "resource_claims": [
        "resource:01:04"
      ]
    },
    {
      "id": "task-02-00",
      "reference_duration_ticks": 2,
      "cost_units": 1,
      "required_capabilities": [
        "capability:0"
      ],
      "semantic_claims": [
        "claim:shared"
      ],
      "resource_claims": [
        "resource:shared"
      ]
    },
    {
      "id": "task-02-01",
      "reference_duration_ticks": 1,
      "cost_units": 1,
      "required_capabilities": [
        "capability:1"
      ],
      "semantic_claims": [
        "claim:shared"
      ],
      "resource_claims": [
        "resource:shared"
      ]
    },
    {
      "id": "task-02-02",
      "reference_duration_ticks": 1,
      "cost_units": 1,
      "required_capabilities": [
        "capability:0"
      ],
      "semantic_claims": [
        "claim:02:02"
      ],
      "resource_claims": [
        "resource:02:02"
      ]
    },
    {
      "id": "task-02-03",
      "reference_duration_ticks": 1,
      "cost_units": 1,
      "required_capabilities": [
        "capability:1"
      ],
      "semantic_claims": [
        "claim:02:03"
      ],
      "resource_claims": [
        "resource:02:03"
      ]
    },
    {
      "id": "task-02-04",
      "reference_duration_ticks": 1,
      "cost_units": 1,
      "required_capabilities": [
        "capability:0"
      ],
      "semantic_claims": [
        "claim:02:04"
      ],
      "resource_claims": [
        "resource:02:04"
      ]
    },
    {
      "id": "task-03-00",
      "reference_duration_ticks": 2,
      "cost_units": 1,
      "required_capabilities": [
        "capability:0"
      ],
      "semantic_claims": [
        "claim:shared"
      ],
      "resource_claims": [
        "resource:shared"
      ]
    },
    {
      "id": "task-03-01",
      "reference_duration_ticks": 1,
      "cost_units": 1,
      "required_capabilities": [
        "capability:1"
      ],
      "semantic_claims": [
        "claim:shared"
      ],
      "resource_claims": [
        "resource:shared"
      ]
    },
    {
      "id": "task-03-02",
      "reference_duration_ticks": 1,
      "cost_units": 1,
      "required_capabilities": [
        "capability:0"
      ],
      "semantic_claims": [
        "claim:03:02"
      ],
      "resource_claims": [
        "resource:03:02"
      ]
    },
    {
      "id": "task-03-03",
      "reference_duration_ticks": 1,
      "cost_units": 1,
      "required_capabilities": [
        "capability:1"
      ],
      "semantic_claims": [
        "claim:03:03"
      ],
      "resource_claims": [
        "resource:03:03"
      ]
    },
    {
      "id": "task-03-04",
      "reference_duration_ticks": 1,
      "cost_units": 1,
      "required_capabilities": [
        "capability:0"
      ],
      "semantic_claims": [
        "claim:03:04"
      ],
      "resource_claims": [
        "resource:03:04"
      ]
    },
    {
      "id": "task-04-00",
      "reference_duration_ticks": 2,
      "cost_units": 1,
      "required_capabilities": [
        "capability:0"
      ],
      "semantic_claims": [
        "claim:shared"
      ],
      "resource_claims": [
        "resource:shared"
      ]
    },
    {
      "id": "task-04-01",
      "reference_duration_ticks": 1,
      "cost_units": 1,
      "required_capabilities": [
        "capability:1"
      ],
      "semantic_claims": [
        "claim:shared"
      ],
      "resource_claims": [
        "resource:shared"
      ]
    },
    {
      "id": "task-04-02",
      "reference_duration_ticks": 1,
      "cost_units": 1,
      "required_capabilities": [
        "capability:0"
      ],
      "semantic_claims": [
        "claim:04:02"
      ],
      "resource_claims": [
        "resource:04:02"
      ]
    },
    {
      "id": "task-04-03",
      "reference_duration_ticks": 1,
      "cost_units": 1,
      "required_capabilities": [
        "capability:1"
      ],
      "semantic_claims": [
        "claim:04:03"
      ],
      "resource_claims": [
        "resource:04:03"
      ]
    },
    {
      "id": "task-04-04",
      "reference_duration_ticks": 1,
      "cost_units": 1,
      "required_capabilities": [
        "capability:0"
      ],
      "semantic_claims": [
        "claim:04:04"
      ],
      "resource_claims": [
        "resource:04:04"
      ]
    },
    {
      "id": "task-05-00",
      "reference_duration_ticks": 2,
      "cost_units": 1,
      "required_capabilities": [
        "capability:0"
      ],
      "semantic_claims": [
        "claim:shared"
      ],
      "resource_claims": [
        "resource:shared"
      ]
    },
    {
      "id": "task-05-01",
      "reference_duration_ticks": 1,
      "cost_units": 1,
      "required_capabilities": [
        "capability:1"
      ],
      "semantic_claims": [
        "claim:shared"
      ],
      "resource_claims": [
        "resource:shared"
      ]
    },
    {
      "id": "task-05-02",
      "reference_duration_ticks": 1,
      "cost_units": 1,
      "required_capabilities": [
        "capability:0"
      ],
      "semantic_claims": [
        "claim:05:02"
      ],
      "resource_claims": [
        "resource:05:02"
      ]
    },
    {
      "id": "task-05-03",
      "reference_duration_ticks": 1,
      "cost_units": 1,
      "required_capabilities": [
        "capability:1"
      ],
      "semantic_claims": [
        "claim:05:03"
      ],
      "resource_claims": [
        "resource:05:03"
      ]
    },
    {
      "id": "task-05-04",
      "reference_duration_ticks": 1,
      "cost_units": 1,
      "required_capabilities": [
        "capability:0"
      ],
      "semantic_claims": [
        "claim:05:04"
      ],
      "resource_claims": [
        "resource:05:04"
      ]
    },
    {
      "id": "task-06-00",
      "reference_duration_ticks": 2,
      "cost_units": 1,
      "required_capabilities": [
        "capability:0"
      ],
      "semantic_claims": [
        "claim:shared"
      ],
      "resource_claims": [
        "resource:shared"
      ]
    },
    {
      "id": "task-06-01",
      "reference_duration_ticks": 1,
      "cost_units": 1,
      "required_capabilities": [
        "capability:1"
      ],
      "semantic_claims": [
        "claim:shared"
      ],
      "resource_claims": [
        "resource:shared"
      ]
    },
    {
      "id": "task-06-02",
      "reference_duration_ticks": 1,
      "cost_units": 1,
      "required_capabilities": [
        "capability:0"
      ],
      "semantic_claims": [
        "claim:06:02"
      ],
      "resource_claims": [
        "resource:06:02"
      ]
    },
    {
      "id": "task-06-03",
      "reference_duration_ticks": 1,
      "cost_units": 1,
      "required_capabilities": [
        "capability:1"
      ],
      "semantic_claims": [
        "claim:06:03"
      ],
      "resource_claims": [
        "resource:06:03"
      ]
    },
    {
      "id": "task-06-04",
      "reference_duration_ticks": 1,
      "cost_units": 1,
      "required_capabilities": [
        "capability:0"
      ],
      "semantic_claims": [
        "claim:06:04"
      ],